CBO 94 Ocupação;CBO 02;nomenclatura;POTECoriginal;potec;Potec Grupo
000-1;-99;outros;Demais Ocupações;Demais Ocupações;Demais Ocupações
01105;213210;Químico industrial, em geral (exceto química agrícola);Físicos, químicos e afins;Físicos, químicos e afins;Profissionais Científicos
01110;213205;Químico, em geral;Físicos, químicos e afins;Físicos, químicos e afins;Profissionais Científicos
01125;213205;Químico (tratamento de água);Físicos, químicos e afins;Físicos, químicos e afins;Profissionais Científicos
01145;213210;Químico (petróleo);Físicos, químicos e afins;Físicos, químicos e afins;Profissionais Científicos
01150;213205;Químico analista;Físicos, químicos e afins;Físicos, químicos e afins;Profissionais Científicos
01155;213205;Químico agrícola;Físicos, químicos e afins;Físicos, químicos e afins;Profissionais Científicos
01190;213205;Outros químicos;Físicos, químicos e afins;Físicos, químicos e afins;Profissionais Científicos
01210;213105;Físico, em geral;Físicos, químicos e afins;Físicos, químicos e afins;Profissionais Científicos
01215;213150;Físico (medicina);Físicos, químicos e afins;Físicos, químicos e afins;Profissionais Científicos
01220;213105;Físico (mecânica);Físicos, químicos e afins;Físicos, químicos e afins;Profissionais Científicos
01230;213175;Físico (térmica);Físicos, químicos e afins;Físicos, químicos e afins;Profissionais Científicos
01235;213105;Físico-químico;Físicos, químicos e afins;Físicos, químicos e afins;Profissionais Científicos
01240;213160;Físico (óptica);Físicos, químicos e afins;Físicos, químicos e afins;Profissionais Científicos
01250;213110;Físico (acústica);Físicos, químicos e afins;Físicos, químicos e afins;Profissionais Científicos
01260;213105;Físico (eletricidade e magnetismo);Físicos, químicos e afins;Físicos, químicos e afins;Profissionais Científicos
01270;213105;Físico (eletrônica);Físicos, químicos e afins;Físicos, químicos e afins;Profissionais Científicos
01280;213155;Físico nuclear;Físicos, químicos e afins;Físicos, químicos e afins;Profissionais Científicos
01290;213105;Outros físicos;Físicos, químicos e afins;Físicos, químicos e afins;Profissionais Científicos
01920;213415;Geofísico;Físicos, químicos e afins;Físicos, químicos e afins;Profissionais Científicos
01930;213315;Meteorologista;Físicos, químicos e afins;Físicos, químicos e afins;Profissionais Científicos
01940;213305;Astrônomo;Físicos, químicos e afins;Físicos, químicos e afins;Profissionais Científicos
01950;203215;Pesquisador de telecomunicações;Pesquisadores;Pesquisadores;Pesquisadores
01990;213120;Outros  químicos,  físicos e trabalhadores assemelhados não-classificados sob outras epígrafes;Físicos, químicos e afins;Físicos, químicos e afins;Profissionais Científicos
02020;222110;Engenheiro agrônomo;Engenheiros agrônomos, de alimentos, florestais e de pesca;Engenheiros agrônomos, de alimentos, florestais e de pesca;Engenheiros
02040;222120;Engenheiro florestal;Engenheiros agrônomos, de alimentos, florestais e de pesca;Engenheiros agrônomos, de alimentos, florestais e de pesca;Engenheiros
02060;222115;Engenheiro de pesca;Engenheiros agrônomos, de alimentos, florestais e de pesca;Engenheiros agrônomos, de alimentos, florestais e de pesca;Engenheiros
02090;222110;Outros engenheiros agrônomos, florestais e de pesca;Engenheiros agrônomos, de alimentos, florestais e de pesca;Engenheiros agrônomos, de alimentos, florestais e de pesca;Engenheiros
02110;214205;Engenheiro civil, em geral;Engenheiros Civis etc;Engenheiros Civis etc;Engenheiros
02115;214215;Engenheiro civil (edificações);Engenheiros Civis etc;Engenheiros Civis etc;Engenheiros
02125;214255;Engenheiro civil (construção de rodovias);Engenheiros Civis etc;Engenheiros Civis etc;Engenheiros
02135;214210;Engenheiro civil (construção de aeroportos);Engenheiros Civis etc;Engenheiros Civis etc;Engenheiros
02145;214225;Engenheiro civil (construção de ferrovias);Engenheiros Civis etc;Engenheiros Civis etc;Engenheiros
02150;214245;Engenheiro civil (construção de pontes e viadutos);Engenheiros Civis etc;Engenheiros Civis etc;Engenheiros
02155;214265;Engenheiro civil (construção de túneis);Engenheiros Civis etc;Engenheiros Civis etc;Engenheiros
02160;214230;Engenheiro civil (mecânica de solos);Engenheiros Civis etc;Engenheiros Civis etc;Engenheiros
02165;214260;Engenheiro civil (obras sanitárias);Engenheiros Civis etc;Engenheiros Civis etc;Engenheiros
02170;214240;Engenheiro civil (hidráulica);Engenheiros Civis etc;Engenheiros Civis etc;Engenheiros
02175;214105;Arquiteto;Engenheiros Civis etc;Engenheiros Civis etc;Engenheiros
02180;214125;Urbanista;Engenheiros Civis etc;Engenheiros Civis etc;Engenheiros
02185;214120;Arquiteto paisagista;Engenheiros Civis etc;Engenheiros Civis etc;Engenheiros
02190;141305;Outros engenheiros civis e arquitetos;Demais Ocupações;Demais Ocupações;Demais Ocupações
02220;214405;Engenheiro de operação (mecânica);Engenheiros Civis etc;Engenheiros Civis etc;Engenheiros
02230;214305;Engenheiro de operação (eletrotécnica);Engenheiros Civis etc;Engenheiros Civis etc;Engenheiros
02240;214365;Engenheiro de operação (eletrônica);Engenheiros Civis etc;Engenheiros Civis etc;Engenheiros
02250;214610;Engenheiro de operação (metalurgia);Engenheiros Civis etc;Engenheiros Civis etc;Engenheiros
02260;214510;Engenheiro de operação (têxtil);Engenheiros Civis etc;Engenheiros Civis etc;Engenheiros
02270;262410;Desenhista industrial (designer);Demais Ocupações;Demais Ocupações;Demais Ocupações
02290;214505;Outros engenheiros de operação e desenhistas industriais;Engenheiros Civis etc;Engenheiros Civis etc;Engenheiros
02305;214305;Engenheiro eletricista, em geral;Engenheiros Civis etc;Engenheiros Civis etc;Engenheiros
02310;214310;Engenheiro eletrônico, em geral;Engenheiros Civis etc;Engenheiros Civis etc;Engenheiros
02320;214305;Engenheiro eletricista (produção de energia);Engenheiros Civis etc;Engenheiros Civis etc;Engenheiros
02330;214305;Engenheiro eletricista (distribuição de energia);Engenheiros Civis etc;Engenheiros Civis etc;Engenheiros
02335;214325;Engenheiro  de manutenção  (eletricidade e eletrônica);Engenheiros Civis etc;Engenheiros Civis etc;Engenheiros
02340;214340;Engenheiro de telecomunicações;Engenheiros Civis etc;Engenheiros Civis etc;Engenheiros
02350;214310;Engenheiro eletrônico (vídeo e áudio);Engenheiros Civis etc;Engenheiros Civis etc;Engenheiros
02385;214365;Tecnólogo em eletricidade e eletrônica;Engenheiros Civis etc;Engenheiros Civis etc;Engenheiros
02390;214305;Outros engenheiros eletricistas e engenheiros eletrônicos;Engenheiros Civis etc;Engenheiros Civis etc;Engenheiros
02410;214405;Engenheiro mecânico, em geral;Engenheiros Civis etc;Engenheiros Civis etc;Engenheiros
02415;214405;Engenheiro mecânico (manutenção);Engenheiros Civis etc;Engenheiros Civis etc;Engenheiros
02420;214405;Engenheiro mecânico (máquinas e ferramentas);Engenheiros Civis etc;Engenheiros Civis etc;Engenheiros
02430;214405;Engenheiro  mecânico  (motores, exceto de embarcações);Engenheiros Civis etc;Engenheiros Civis etc;Engenheiros
02440;214405;Engenheiro mecânico (motores de embarcações);Engenheiros Civis etc;Engenheiros Civis etc;Engenheiros
02445;214405;Engenheiro mecânico (motores diesel);Engenheiros Civis etc;Engenheiros Civis etc;Engenheiros
02450;214430;Engenheiro naval;Engenheiros Civis etc;Engenheiros Civis etc;Engenheiros
02460;214425;Engenheiro aeronáutico;Engenheiros Civis etc;Engenheiros Civis etc;Engenheiros
02465;214405;Engenheiro mecânico (armamento);Engenheiros Civis etc;Engenheiros Civis etc;Engenheiros
02470;214410;Engenheiro mecânico (veículos automotores);Engenheiros Civis etc;Engenheiros Civis etc;Engenheiros
02480;214405;Engenheiro  mecânico  (calefação, ventilação e refrigeração);Engenheiros Civis etc;Engenheiros Civis etc;Engenheiros
02483;214610;Tecnólogo em soldagem;Engenheiros Civis etc;Engenheiros Civis etc;Engenheiros
02485;214415;Engenheiro mecânico (energia nuclear);Engenheiros Civis etc;Engenheiros Civis etc;Engenheiros
02490;214405;Outros engenheiros mecânicos;Engenheiros Civis etc;Engenheiros Civis etc;Engenheiros
02510;214505;Engenheiro químico, em geral;Engenheiros Civis etc;Engenheiros Civis etc;Engenheiros
02520;214525;Engenheiro químico (petróleo);Engenheiros Civis etc;Engenheiros Civis etc;Engenheiros
02530;214520;Engenheiro químico (celulose, papel e papelão);Engenheiros Civis etc;Engenheiros Civis etc;Engenheiros
02540;214525;Engenheiro químico (borracha);Engenheiros Civis etc;Engenheiros Civis etc;Engenheiros
02550;214505;Engennheiro químico (plástico);Engenheiros Civis etc;Engenheiros Civis etc;Engenheiros
02590;214505;Outros engenherios químicos;Engenheiros Civis etc;Engenheiros Civis etc;Engenheiros
02620;214610;Engenheiro metalúrgico (produção de metais);Engenheiros Civis etc;Engenheiros Civis etc;Engenheiros
02630;214610;Engenheiro metalúrgico (tratamento de metais);Engenheiros Civis etc;Engenheiros Civis etc;Engenheiros
02690;214605;Outros engenheiros metalúrgicos;Engenheiros Civis etc;Engenheiros Civis etc;Engenheiros
02710;214705;Engenheiro de minas, em geral;Engenheiros Civis etc;Engenheiros Civis etc;Engenheiros
02720;214705;Engenheiro de minas (carvão);Engenheiros Civis etc;Engenheiros Civis etc;Engenheiros
02730;214705;Engenheiro de minas (minerais metálicos);Engenheiros Civis etc;Engenheiros Civis etc;Engenheiros
02740;214705;Engenheiro de minas (petróleo);Engenheiros Civis etc;Engenheiros Civis etc;Engenheiros
02750;213405;Geólogo;Físicos, químicos e afins;Físicos, químicos e afins;Profissionais Científicos
02760;214705;Engenheiro de Minas (Concentra|`o);Engenheiros Civis etc;Engenheiros Civis etc;Engenheiros
02790;214705;Outros engenheiros de minas e geólogos;Engenheiros Civis etc;Engenheiros Civis etc;Engenheiros
02810;214905;Engenheiro de organização e métodos, em geral;Engenheiros Civis etc;Engenheiros Civis etc;Engenheiros
02830;214925;Engenheiro de tempos e movimentos;Engenheiros Civis etc;Engenheiros Civis etc;Engenheiros
02840;214915;Engenheiro de segurança do trabalho;Engenheiros Civis etc;Engenheiros Civis etc;Engenheiros
02850;214910;Engenheiro de controle de qualidade;Engenheiros Civis etc;Engenheiros Civis etc;Engenheiros
02890;214905;Outros engenheiros de organização e métodos;Engenheiros Civis etc;Engenheiros Civis etc;Engenheiros
02920;214605;Engenheiro de cerâmica e vidros;Engenheiros Civis etc;Engenheiros Civis etc;Engenheiros
02935;214805;Engenheiro agrimensor;Engenheiros Civis etc;Engenheiros Civis etc;Engenheiros
02940;214505;Engenheiro tecnólogo de alimentos e bebidas;Engenheiros Civis etc;Engenheiros Civis etc;Engenheiros
02950;214255;Engenheiro de tráfego;Engenheiros Civis etc;Engenheiros Civis etc;Engenheiros
02960;203210;Engenheiro Pesquisador;Pesquisadores;Pesquisadores;Pesquisadores
02990;214355;Outros engenheiros, arquitetos e trabalhadores assemelhados não-classificados sob outras epígrafes;Engenheiros Civis etc;Engenheiros Civis etc;Engenheiros Civis etc
03020;351105;Técnico de contabilidade;Demais Ocupações;Demais Ocupações;Demais Ocupações
03030;424125;Técnico de estatística;Demais Ocupações;Demais Ocupações;Demais Ocupações
03040;351305;Técnico de economia doméstica;Demais Ocupações;Demais Ocupações;Demais Ocupações
03050;351305;Técnico de administração;Demais Ocupações;Demais Ocupações;Demais Ocupações
03060;351310;Técnico de administração em comércio exterior;Demais Ocupações;Demais Ocupações;Demais Ocupações
03090;351105;Outros  técnicos  de  contabilidade,  estatística, economia doméstica e administração;Demais Ocupações;Demais Ocupações;Demais Ocupações
03110;321110;Técnico agropecuário, em geral;Demais Ocupações;Demais Ocupações;Técnicos
03120;321105;Técnico agrícola;Demais Ocupações;Demais Ocupações;Técnicos
03130;323105;Técnico de pecuária;Demais Ocupações;Demais Ocupações;Técnicos
03140;324205;Técnico de laboratório de análises clínicas;Demais Ocupações;Demais Ocupações;Demais Ocupações
03145;324210;Laboratorista (análises clínicas);Demais Ocupações;Demais Ocupações;Demais Ocupações
03150;323105;Técnico de veterinária;Demais Ocupações;Demais Ocupações;Técnicos
03160;321305;Técnico de piscicultura;Demais Ocupações;Demais Ocupações;Técnicos
03190;203020;Outros  técnicos  de biologia, agronomia  e trabalhadores assemelhados;Pesquisadores;Pesquisadores;Pesquisadores
03205;316305;Técnico de mineração, em geral;Demais Ocupações;Demais Ocupações;Técnicos
03210;314620;Técnico metalúrgico, em geral;Demais Ocupações;Demais Ocupações;Técnicos
03212;314725;Técnico de redução (primeira fusão);Demais Ocupações;Demais Ocupações;Técnicos
03214;314710;Técnico de aciaria;Demais Ocupações;Demais Ocupações;Técnicos
03215;314730;Técnico de refratario;Demais Ocupações;Demais Ocupações;Técnicos
03216;314720;Técnico de laminação;Demais Ocupações;Demais Ocupações;Técnicos
03218;314705;Técnico de acabamento;Demais Ocupações;Demais Ocupações;Técnicos
03219;314715;Técnico de fundição (usinagem de peças de metais);Demais Ocupações;Demais Ocupações;Técnicos
03220;316310;Técnico de mineração (petróleo e gás natural);Demais Ocupações;Demais Ocupações;Técnicos
03225;214610;Tecnólogo em processos de produção e usinagem;Engenheiros Civis etc;Engenheiros Civis etc;Engenheiros
03230;316110;Técnico de geologia;Demais Ocupações;Demais Ocupações;Técnicos
03290;141205;Outros  técnicos de mineração, metalurgia  e  geologia;Demais Ocupações;Demais Ocupações;Demais Ocupações
03315;312105;Técnico de obras civis;Demais Ocupações;Demais Ocupações;Técnicos
03330;312305;Técnico de agrimensura;Demais Ocupações;Demais Ocupações;Técnicos
03350;312315;Técnico de hidrografia;Demais Ocupações;Demais Ocupações;Técnicos
03360;312205;Técnico de estradas;Demais Ocupações;Demais Ocupações;Técnicos
03370;312210;Técnico de saneamento;Demais Ocupações;Demais Ocupações;Técnicos
03380;312320;Topógrafo;Demais Ocupações;Demais Ocupações;Técnicos
03390;312105;Outros  técnicos  de obras civis, agrimensura, estradas, saneamento e trabalhadores assemelhados;Demais Ocupações;Demais Ocupações;Técnicos
03405;313105;Eletrotécnico, em geral;Demais Ocupações;Demais Ocupações;Técnicos
03410;313215;Técnico eletrônico, em geral;Demais Ocupações;Demais Ocupações;Técnicos
03430;313315;Técnico de telecomunicações;Demais Ocupações;Demais Ocupações;Técnicos
03435;313120;Técnico de manutenção elétrica;Demais Ocupações;Demais Ocupações;Técnicos
03436;313125;Técnico de manutenção  elétrica de máquinas e veículos automotores em geral;Demais Ocupações;Demais Ocupações;Técnicos
03440;313205;Técnico de manutenção eletrônica;Demais Ocupações;Demais Ocupações;Técnicos
03442;313210;Tecnico de manuten|`o eletronica (Circuitos com maquinas com comando numerico);Demais Ocupações;Demais Ocupações;Técnicos
03445;313315;Técnico de manutenção de equipamento  de comutação telefônica;Demais Ocupações;Demais Ocupações;Técnicos
03447;313320;Técnico de manutenção de equipamento  de transmissão;Demais Ocupações;Demais Ocupações;Técnicos
03450;313315;Técnico de telefonia;Demais Ocupações;Demais Ocupações;Técnicos
03455;313320;Técnico de transmissão;Demais Ocupações;Demais Ocupações;Técnicos
03460;313315;Técnico de manipulação de tráfego telefônico;Demais Ocupações;Demais Ocupações;Técnicos
03475;313315;Inspetor  de centrais  privadas de comutação telefônica;Demais Ocupações;Demais Ocupações;Técnicos
03482;313315;Analisador de tráfego telefônico;Demais Ocupações;Demais Ocupações;Técnicos
03490;213310;Outros  técnicos de eletricidade, eletrônica e telecomunicações;Físicos, químicos e afins;Físicos, químicos e afins;Profissionais Científicos
03510;314110;Técnico mecânico, em geral;Demais Ocupações;Demais Ocupações;Técnicos
03530;314310;Técnico mecânico (aeronaves);Demais Ocupações;Demais Ocupações;Demais Ocupações
03540;314305;Técnico mecânico (veículos automotores);Demais Ocupações;Demais Ocupações;Demais Ocupações
03550;314115;Técnico mecânico (calefação, ventilação e refrigeração);Demais Ocupações;Demais Ocupações;Técnicos
03560;314315;Técnico mecânico (embarcações);Demais Ocupações;Demais Ocupações;Demais Ocupações
03570;314125;Técnico mecânico (motores);Demais Ocupações;Demais Ocupações;Técnicos
03575;314120;Técnico mecânico (máquinas);Demais Ocupações;Demais Ocupações;Técnicos
03590;300305;Outros técnicos de mecânica;Demais Ocupações;Demais Ocupações;Técnicos
03605;311105;Técnico químico, em geral;Demais Ocupações;Demais Ocupações;Técnicos
03615;301115;Técnico de laboratório de análises físico-químicas (petróleo);Demais Ocupações;Demais Ocupações;Técnicos
03620;311205;Técnico químico (petroquímica);Demais Ocupações;Demais Ocupações;Técnicos
03630;301110;Técnico de laboratório de análises físico-químicas (materiais    de construção);Demais Ocupações;Demais Ocupações;Técnicos
03640;301105;Laboratorista industrial;Demais Ocupações;Demais Ocupações;Técnicos
03650;325115;Técnico em farmácia;Demais Ocupações;Demais Ocupações;Técnicos
03690;301105;Outros  técnicos  de química e trabalhadores assemelhados;Demais Ocupações;Demais Ocupações;Técnicos
03710;311605;Técnico têxtil, em geral;Demais Ocupações;Demais Ocupações;Técnicos
03720;311615;Técnico têxtil (fiação);Demais Ocupações;Demais Ocupações;Técnicos
03730;311625;Técnico têxtil (tecelagem);Demais Ocupações;Demais Ocupações;Técnicos
03740;311610;Técnico têxtil (tratamentos químicos);Demais Ocupações;Demais Ocupações;Técnicos
03750;311620;Técnico têxtil (malharia);Demais Ocupações;Demais Ocupações;Técnicos
03790;301105;Outros técnicos têxteis;Demais Ocupações;Demais Ocupações;Técnicos
03805;318005;Desenhista técnico, em geral;Demais Ocupações;Demais Ocupações;Técnicos
03810;318430;Desenhista Técnico Industrial;Demais Ocupações;Demais Ocupações;Técnicos
03820;318205;Desenhista técnico (mecânica);Demais Ocupações;Demais Ocupações;Técnicos
03825;318310;Desenhista  técnico (calefação,ventilação e refrigeração);Demais Ocupações;Demais Ocupações;Técnicos
03830;318305;Desenhista técnico (eletricidade e eletrônica);Demais Ocupações;Demais Ocupações;Técnicos
03835;318115;Desenhista técnico (construção civil);Demais Ocupações;Demais Ocupações;Técnicos
03840;318420;Desenhista técnico (indústria têxtil);Demais Ocupações;Demais Ocupações;Técnicos
03845;318105;Desenhista técnico (arquitetura);Demais Ocupações;Demais Ocupações;Técnicos
03850;318215;Desenhista técnico (construção naval);Demais Ocupações;Demais Ocupações;Técnicos
03855;318110;Desenhista técnico (cartografia);Demais Ocupações;Demais Ocupações;Técnicos
03860;318415;Desenhista técnico (ilustrações técnicas);Demais Ocupações;Demais Ocupações;Técnicos
03865;318425;Desenhista técnico (mobiliário);Demais Ocupações;Demais Ocupações;Técnicos
03870;318405;Desenhista técnico (artes gráficas);Demais Ocupações;Demais Ocupações;Técnicos
03875;318120;Desenhista técnico (instalações hidrossanitárias);Demais Ocupações;Demais Ocupações;Técnicos
03880;318210;Desenhista técnico (construção de aeronaves);Demais Ocupações;Demais Ocupações;Técnicos
03883;318015;Desenhista projetista;Demais Ocupações;Demais Ocupações;Técnicos
03884;318410;Desenhista de ilustração;Demais Ocupações;Demais Ocupações;Técnicos
03885;318015;Desenhista detalhista;Demais Ocupações;Demais Ocupações;Técnicos
03887;318010;Desenhista copista;Demais Ocupações;Demais Ocupações;Técnicos
03890;312305;Outros desenhistas técnicos;Demais Ocupações;Demais Ocupações;Técnicos
03930;391105;Cronoanalista;Demais Ocupações;Demais Ocupações;Demais Ocupações
03935;391125;Técnico de planejamento de produção;Demais Ocupações;Demais Ocupações;Demais Ocupações
03937;391220;Técnico de painel de controle;Demais Ocupações;Demais Ocupações;Demais Ocupações
03940;391110;Cronometrista;Demais Ocupações;Demais Ocupações;Demais Ocupações
03945;351605;Técnico de segurança do trabalho;Demais Ocupações;Demais Ocupações;Demais Ocupações
03948;342120;Técnico de servico de apoio;Demais Ocupações;Demais Ocupações;Demais Ocupações
03950;311510;Técnico de meteorologia;Demais Ocupações;Demais Ocupações;Técnicos
03960;311305;Técnico de cerâmica e vidros;Demais Ocupações;Demais Ocupações;Técnicos
03965;311515;Técnico  de utilidade  (produção e distribuição de vapor, gases, óleos, combustíveis, energia, oxigê;Demais Ocupações;Demais Ocupações;Técnicos
03970;311110;Técnico de celulose e papel;Demais Ocupações;Demais Ocupações;Técnicos
03975;351715;Inspetor de produção;Demais Ocupações;Demais Ocupações;Demais Ocupações
03980;325205;Técnico de alimentos;Demais Ocupações;Demais Ocupações;Técnicos
03982;371305;Técnico de microfilmagem;Demais Ocupações;Demais Ocupações;Demais Ocupações
03983;371310;Técnico gráfico;Demais Ocupações;Demais Ocupações;Demais Ocupações
03984;371305;Técnico em programação visual;Demais Ocupações;Demais Ocupações;Demais Ocupações
03985;391205;Inspetor de qualidade;Demais Ocupações;Demais Ocupações;Demais Ocupações
03987;351725;Inspetor de risco;Demais Ocupações;Demais Ocupações;Demais Ocupações
03988;300305;Técnico eletromecânico;Demais Ocupações;Demais Ocupações;Técnicos
03989;391135;Técnico de matéria-prima e material;Demais Ocupações;Demais Ocupações;Demais Ocupações
03990;141420;Outros  técnicos  e  trabalhadores  assemelhados não-classificados sobre outras epígrafes;Demais Ocupações;Demais Ocupações;Demais Ocupações
04120;215305;Piloto comercial (linhas aéreas);Demais Ocupações;Demais Ocupações;Demais Ocupações
04130;341105;Piloto comercial (exceto linhas aéreas);Demais Ocupações;Demais Ocupações;Demais Ocupações
04135;215305;Piloto de helicóptero;Demais Ocupações;Demais Ocupações;Demais Ocupações
04140;215305;Navegador de aeronave;Demais Ocupações;Demais Ocupações;Demais Ocupações
04150;341115;Mecânico de vôo;Demais Ocupações;Demais Ocupações;Demais Ocupações
04160;215315;Instrutor de vôo;Demais Ocupações;Demais Ocupações;Demais Ocupações
04170;215310;Piloto de provas (aviação);Demais Ocupações;Demais Ocupações;Demais Ocupações
04190;215305;Outros  pilotos de aviação comercial, navegadores, mecânicos de vôo e trabalhadores assemelhados;Demais Ocupações;Demais Ocupações;Demais Ocupações
04215;215115;Comandante de embarcações (navegação marítima);Demais Ocupações;Demais Ocupações;Demais Ocupações
04220;215115;Comandante de embarcação (navegação interior);Demais Ocupações;Demais Ocupações;Demais Ocupações
04230;215115;Oficial de navegação marítima e interior;Demais Ocupações;Demais Ocupações;Demais Ocupações
04240;341215;Piloto-prático de navegação marítima e interior;Demais Ocupações;Demais Ocupações;Demais Ocupações
04250;215220;Superintendente   de  aprovisionamento  (navegação marítima e interior);Demais Ocupações;Demais Ocupações;Demais Ocupações
04290;215105;Outros oficiais de bordo, pilotos e trabalhadores assemelhados (navegação marítima e interior);Demais Ocupações;Demais Ocupações;Demais Ocupações
04315;215210;Primeiro oficial-maquinista (embarcações);Demais Ocupações;Demais Ocupações;Demais Ocupações
04320;215205;Oficial-maquinista (embarcações);Demais Ocupações;Demais Ocupações;Demais Ocupações
04330;215220;Superintendente técnico (embarcações);Demais Ocupações;Demais Ocupações;Demais Ocupações
04390;215205;Outros oficiais-maquinistas (navegação marítima e interior);Demais Ocupações;Demais Ocupações;Demais Ocupações
05110;221105;Biologista, em geral;Biólogos e biomédicos;Biólogos e biomédicos;Profissionais Científicos
05120;203025;Botânico;Pesquisadores;Pesquisadores;Pesquisadores
05125;203005;Ecólogo;Pesquisadores;Pesquisadores;Pesquisadores
05130;203010;Zoólogo;Pesquisadores;Pesquisadores;Pesquisadores
05140;203015;Anatomista;Pesquisadores;Pesquisadores;Pesquisadores
05150;203020;Fisiologista;Pesquisadores;Pesquisadores;Pesquisadores
05190;203005;Outros biologistas e trabalhadores assemelhados;Pesquisadores;Pesquisadores;Pesquisadores
05230;223410;Bioquímico;Demais Ocupações;Demais Ocupações;Demais Ocupações
05250;203015;Bacteriologista;Pesquisadores;Pesquisadores;Pesquisadores
05270;223405;Farmacologista;Demais Ocupações;Demais Ocupações;Demais Ocupações
05290;203015;Outros  bacteriologistas, farmacologistas e trabalhadores assemelhados;Pesquisadores;Pesquisadores;Pesquisadores
06105;#N/D;Médico, em geral;Demais Ocupações;Demais Ocupações;Demais Ocupações
06110;#N/D;Cirurgião, em geral;Demais Ocupações;Demais Ocupações;Demais Ocupações
06113;#N/D;Médico de perícias médicas;Demais Ocupações;Demais Ocupações;Demais Ocupações
06115;#N/D;Médico anestesista;Demais Ocupações;Demais Ocupações;Demais Ocupações
06117;#N/D;Médico cardiologista;Demais Ocupações;Demais Ocupações;Demais Ocupações
06119;#N/D;Médico dermatologista;Demais Ocupações;Demais Ocupações;Demais Ocupações
06122;#N/D;Médico do trabalho;Demais Ocupações;Demais Ocupações;Demais Ocupações
