81220;773340;Operador de serras (lavra de madeira);Demais Ocupações;Demais Ocupações;Demais Ocupações
81230;773355;Torneiro (lavra de madeira);Demais Ocupações;Demais Ocupações;Demais Ocupações
81240;773345;Operador de torno automático (lavra de madeira);Demais Ocupações;Demais Ocupações;Demais Ocupações
81250;773330;Operador de molduradora (lavra de madeira);Demais Ocupações;Demais Ocupações;Demais Ocupações
81260;773310;Operador de entalhadeira (lavra de madeira);Demais Ocupações;Demais Ocupações;Demais Ocupações
81265;773320;Operador de lixadeira (lavra de madeira);Demais Ocupações;Demais Ocupações;Demais Ocupações
81270;773335;Operador de plaina (lavra de madeira);Demais Ocupações;Demais Ocupações;Demais Ocupações
81280;773315;Operador de fresadora (lavra de madeira);Demais Ocupações;Demais Ocupações;Demais Ocupações
81285;773415;Operador de máquina de lavrar madeira (produção em série);Demais Ocupações;Demais Ocupações;Demais Ocupações
81290;715510;Outros operadores de máquinas de lavrar madeira;Demais Ocupações;Demais Ocupações;Demais Ocupações
81930;771120;Tanoeiro;Demais Ocupações;Demais Ocupações;Demais Ocupações
81935;771110;Modelador de madeira;Demais Ocupações;Demais Ocupações;Demais Ocupações
81940;771115;Maquetista;Demais Ocupações;Demais Ocupações;Demais Ocupações
81945;775105;Entalhador;Demais Ocupações;Demais Ocupações;Demais Ocupações
81965;775120;Marcheteiro;Demais Ocupações;Demais Ocupações;Demais Ocupações
81990;716535;Outros  marceneiros, operadores de máquinas de lavrar  madeira  e  trabalhadores  assemelhados não  classificados anteri;Demais Ocupações;Demais Ocupações;Demais Ocupações
82020;712205;Cortador de pedras;Demais Ocupações;Demais Ocupações;Demais Ocupações
82025;712220;Polidor de pedras;Demais Ocupações;Demais Ocupações;Demais Ocupações
82040;712230;Traçador de pedras;Demais Ocupações;Demais Ocupações;Demais Ocupações
82050;712225;Torneiro (lavra de pedra);Demais Ocupações;Demais Ocupações;Demais Ocupações
82060;712210;Gravador de inscrições em pedra;Demais Ocupações;Demais Ocupações;Demais Ocupações
82070;712215;Gravador de relevos em pedra;Demais Ocupações;Demais Ocupações;Demais Ocupações
82090;711130;Outros  cortadores,  polidores e gravadores de pedras;Demais Ocupações;Demais Ocupações;Demais Ocupações
83110;722105;Forjador, em geral;Demais Ocupações;Demais Ocupações;Demais Ocupações
83130;722110;Forjador a martelo-pilão;Demais Ocupações;Demais Ocupações;Demais Ocupações
83140;722115;Forjador prensista;Demais Ocupações;Demais Ocupações;Demais Ocupações
83190;717010;Outros forjadores;Demais Ocupações;Demais Ocupações;Demais Ocupações
83210;721105;Ferramenteiro, em geral;Demais Ocupações;Demais Ocupações;Demais Ocupações
83215;721105;Ferramenteiro de corte e repuxo;Demais Ocupações;Demais Ocupações;Demais Ocupações
83230;721110;Ferramenteiro de mandris, calibradores e outros dispositivos;Demais Ocupações;Demais Ocupações;Demais Ocupações
83240;721115;Modelador de metal (fundição);Demais Ocupações;Demais Ocupações;Demais Ocupações
83250;721105;Riscador de metais;Demais Ocupações;Demais Ocupações;Demais Ocupações
83290;391205;Outros ferramenteiros e modeladores de metais;Demais Ocupações;Demais Ocupações;Demais Ocupações
83308;721210;Operador de Maquinas operatrizes, em geral;Demais Ocupações;Demais Ocupações;Demais Ocupações
83315;721215;Furador;Demais Ocupações;Demais Ocupações;Demais Ocupações
83317;721220;Retificador;Demais Ocupações;Demais Ocupações;Demais Ocupações
83319;721215;Retificador de fieiras;Demais Ocupações;Demais Ocupações;Demais Ocupações
83320;721215;Torneiro  mecânico;Demais Ocupações;Demais Ocupações;Demais Ocupações
83325;721210;Torneiro repuxador;Demais Ocupações;Demais Ocupações;Demais Ocupações
83327;721205;Operador de máquina de eletroerosão;Demais Ocupações;Demais Ocupações;Demais Ocupações
83330;721215;Fresador (fresadora universal);Demais Ocupações;Demais Ocupações;Demais Ocupações
83340;721215;Plainador de metais (plaina limadora);Demais Ocupações;Demais Ocupações;Demais Ocupações
83350;721415;Mandrilador;Demais Ocupações;Demais Ocupações;Demais Ocupações
83355;721210;Brunidor de cilindros;Demais Ocupações;Demais Ocupações;Demais Ocupações
83360;721215;Furador (furadeira radial);Demais Ocupações;Demais Ocupações;Demais Ocupações
83365;721210;Broqueador de cilindros;Demais Ocupações;Demais Ocupações;Demais Ocupações
83367;721210;Foscador de cilindros (laminação);Demais Ocupações;Demais Ocupações;Demais Ocupações
83370;721220;Retificador (retificadora plana);Demais Ocupações;Demais Ocupações;Demais Ocupações
83375;721220;Retificador (retificadora cilíndrica externa e interna);Demais Ocupações;Demais Ocupações;Demais Ocupações
83385;721220;Retificador (retificadora de árvores de manivelas);Demais Ocupações;Demais Ocupações;Demais Ocupações
83390;721205;Outros torneiros, fresadores, retificadores e trabalhadores assemelhados;Demais Ocupações;Demais Ocupações;Demais Ocupações
83410;721225;Preparador  de máquinas-ferramentas, em geral (pro dução em série);Demais Ocupações;Demais Ocupações;Demais Ocupações
83415;721225;Preparador  de prensa mecânica de metais (produção em série);Demais Ocupações;Demais Ocupações;Demais Ocupações
83417;721225;Preparador de Ferramentas para maquinas - ferramentas com comando;Demais Ocupações;Demais Ocupações;Demais Ocupações
83420;721225;Preparador de torno automático (produção em série);Demais Ocupações;Demais Ocupações;Demais Ocupações
83425;721225;Preparador de torno revólver (produção em série);Demais Ocupações;Demais Ocupações;Demais Ocupações
83427;721225;Preparador de torno copiador (produção em série);Demais Ocupações;Demais Ocupações;Demais Ocupações
83435;721225;Preparador de fresadora copiadora (produção em série);Demais Ocupações;Demais Ocupações;Demais Ocupações
83437;721225;Preparador  de  fresadora de engrenagens (produção em série);Demais Ocupações;Demais Ocupações;Demais Ocupações
83445;721225;Preparador de furadeira (produção em série);Demais Ocupações;Demais Ocupações;Demais Ocupações
83465;721225;Preparador de retificadora sem centro (produção em série);Demais Ocupações;Demais Ocupações;Demais Ocupações
83480;721225;Preparador  de  máquina de transferência (produção em série);Demais Ocupações;Demais Ocupações;Demais Ocupações
83485;721225;Preparador de máquina de tarraxar (produção em série);Demais Ocupações;Demais Ocupações;Demais Ocupações
83490;721225;Outros  preparadores de máquinas-ferramentas (produção em série);Demais Ocupações;Demais Ocupações;Demais Ocupações
83510;721215;Operador de máquinas-ferramentas, em geral (produção em série);Demais Ocupações;Demais Ocupações;Demais Ocupações
83515;721210;Operador de prensa mecânica de metais (produção em série);Demais Ocupações;Demais Ocupações;Demais Ocupações
83520;721210;Operador de torno automático (produção em série);Demais Ocupações;Demais Ocupações;Demais Ocupações
83525;721210;Operador de torno revólver (produção em série);Demais Ocupações;Demais Ocupações;Demais Ocupações
83530;721210;Operador de torno copiador (produção em série);Demais Ocupações;Demais Ocupações;Demais Ocupações
83535;721215;Operador  de  fresadora copiadora (produção em série);Demais Ocupações;Demais Ocupações;Demais Ocupações
83540;721215;Operador  de fresadora de engrenagens (produção em série);Demais Ocupações;Demais Ocupações;Demais Ocupações
83545;721215;Operador de furadeira (produção em série);Demais Ocupações;Demais Ocupações;Demais Ocupações
83550;721220;Operador  de  retificadora sem centro (produção em série);Demais Ocupações;Demais Ocupações;Demais Ocupações
83555;721210;Operador de serra de metais (produção em série);Demais Ocupações;Demais Ocupações;Demais Ocupações
83560;721210;Operador  de máquina de transferência (produção em série);Demais Ocupações;Demais Ocupações;Demais Ocupações
83565;721210;Operador  de  máquina de tarraxar (produção em série);Demais Ocupações;Demais Ocupações;Demais Ocupações
83590;721105;Outros  operadores de máquinas-ferramentas (produção em série);Demais Ocupações;Demais Ocupações;Demais Ocupações
83620;721325;Polidor de metais;Demais Ocupações;Demais Ocupações;Demais Ocupações
83630;721315;Afiador de ferramentas;Demais Ocupações;Demais Ocupações;Demais Ocupações
83640;721310;Afiador de cutelaria;Demais Ocupações;Demais Ocupações;Demais Ocupações
83650;721320;Afiador de serras;Demais Ocupações;Demais Ocupações;Demais Ocupações
83660;721305;Afiador de cardas;Demais Ocupações;Demais Ocupações;Demais Ocupações
83690;721210;Outros  polidores  de metais e afiadores de ferramentas;Demais Ocupações;Demais Ocupações;Demais Ocupações
83715;721405;Operador de furadeira com comando numerico;Demais Ocupações;Demais Ocupações;Demais Ocupações
83717;721425;Operador de retificadora com comando numerico;Demais Ocupações;Demais Ocupações;Demais Ocupações
83720;721430;Operador de torno com comando numerico;Demais Ocupações;Demais Ocupações;Demais Ocupações
83727;721420;Operador de maquina eletroerosão, a fio, com comando numerico;Demais Ocupações;Demais Ocupações;Demais Ocupações
83730;721410;Operador de fresador com comando numerico;Demais Ocupações;Demais Ocupações;Demais Ocupações
83750;721415;Operador de madriladora com comando numerico;Demais Ocupações;Demais Ocupações;Demais Ocupações
83760;721405;Operador de centro de usinagem com comando numerico;Demais Ocupações;Demais Ocupações;Demais Ocupações
83790;721405;Outros operadores de maquinas - ferramentas com comando numerico;Demais Ocupações;Demais Ocupações;Demais Ocupações
83915;724440;Serralheiro;Demais Ocupações;Demais Ocupações;Demais Ocupações
83980;821440;Operador de tesoura mecânica e máquina de corte;Demais Ocupações;Demais Ocupações;Demais Ocupações
83990;724440;Outros  trabalhadores  da  usinagem de metais não-classificados sob outras epígrafes;Demais Ocupações;Demais Ocupações;Demais Ocupações
84010;725010;Ajustador mecânico, em geral;Demais Ocupações;Demais Ocupações;Demais Ocupações
84020;725015;Ajustador  mecânico  (usinagem em bancada e em máquinas-ferramentas);Demais Ocupações;Demais Ocupações;Demais Ocupações
84030;725020;Ajustador mecânico em bancada;Demais Ocupações;Demais Ocupações;Demais Ocupações
84090;725010;Outros ajustadores mecânicos;Demais Ocupações;Demais Ocupações;Demais Ocupações
84110;725205;Montador de máquina, em geral;Demais Ocupações;Demais Ocupações;Demais Ocupações
84113;725305;Montador de equipamento de levantamento;Demais Ocupações;Demais Ocupações;Demais Ocupações
84115;725415;Montador de motores de explosão e diesel;Demais Ocupações;Demais Ocupações;Demais Ocupações
84120;725405;Montador de motores de aeronaves;Demais Ocupações;Demais Ocupações;Demais Ocupações
84125;725410;Montador de motores de embarcações;Demais Ocupações;Demais Ocupações;Demais Ocupações
84130;725420;Montador de turbinas (exceto turbinas de aeronaves e de embarcações);Demais Ocupações;Demais Ocupações;Demais Ocupações
84135;725225;Montador  de máquinas-ferramentas (usinagem de metais);Demais Ocupações;Demais Ocupações;Demais Ocupações
84140;725315;Montador de máquinas de minas e pedreiras;Demais Ocupações;Demais Ocupações;Demais Ocupações
84145;725210;Montador de máquinas gráficas;Demais Ocupações;Demais Ocupações;Demais Ocupações
84150;725220;Montador de máquinas têxteis;Demais Ocupações;Demais Ocupações;Demais Ocupações
84155;725215;Montador de máquinas operatrizes para madeira;Demais Ocupações;Demais Ocupações;Demais Ocupações
84160;725310;Montador de máquinas agrícolas;Demais Ocupações;Demais Ocupações;Demais Ocupações
84165;725320;Montador de máquinas de terraplenagem;Demais Ocupações;Demais Ocupações;Demais Ocupações
84170;725105;Montador de máquinas de escritório;Demais Ocupações;Demais Ocupações;Demais Ocupações
84180;725705;Montador de instalações de calefação, ventilação e refrigeração;Demais Ocupações;Demais Ocupações;Demais Ocupações
84185;725605;Montador de estruturas de aeronaves;Demais Ocupações;Demais Ocupações;Demais Ocupações
84187;725610;Montador de sistemas de combustível de aeronaves;Demais Ocupações;Demais Ocupações;Demais Ocupações
84190;391205;Outros montadores de máquinas;Demais Ocupações;Demais Ocupações;Demais Ocupações
84220;741120;Relojoeiro (fabricação);Demais Ocupações;Demais Ocupações;Demais Ocupações
84225;741125;Relojoeiro (reparação);Demais Ocupações;Demais Ocupações;Demais Ocupações
84230;741105;Ajustador de instrumentos de precisão;Demais Ocupações;Demais Ocupações;Demais Ocupações
84235;741110;Montador de instrumentos de óptica;Demais Ocupações;Demais Ocupações;Demais Ocupações
84240;741115;Montador de instrumentos de precisão;Demais Ocupações;Demais Ocupações;Demais Ocupações
84245;322505;Ajustador de aparelhos ortopédicos;Demais Ocupações;Demais Ocupações;Demais Ocupações
84250;322410;Protético dentário;Demais Ocupações;Demais Ocupações;Técnicos
84260;741115;Montador de balanças;Demais Ocupações;Demais Ocupações;Demais Ocupações
84270;741115;Montador de taxímetros;Demais Ocupações;Demais Ocupações;Demais Ocupações
84290;741105;Outros relojoeiros e montadores de instrumentos de precisão;Demais Ocupações;Demais Ocupações;Demais Ocupações
84320;914405;Mecânico de manutenção de automóveis motocicletas e veículos similares;Demais Ocupações;Demais Ocupações;Demais Ocupações
84340;914415;Mecânico de manutenção de motocicletas;Demais Ocupações;Demais Ocupações;Demais Ocupações
84350;914425;Mecânico  de  manutenção de veículos automotores a diesel (exceto tratores);Demais Ocupações;Demais Ocupações;Demais Ocupações
84360;914420;Mecânico de manutenção de tratores;Demais Ocupações;Demais Ocupações;Demais Ocupações
84390;914405;Outros mecânicos de manutenção de veículos automotores;Demais Ocupações;Demais Ocupações;Demais Ocupações
84410;914105;Mecânico de manutenção de aeronaves, em geral;Demais Ocupações;Demais Ocupações;Demais Ocupações
84425;914105;Mecânico  de  manutenção  de aeronaves (serviço de pista);Demais Ocupações;Demais Ocupações;Demais Ocupações
84430;914110;Mecânico  de  manutenção  de sistema hidráulico de aeronaves (serviço de pista e hangar);Demais Ocupações;Demais Ocupações;Demais Ocupações
84440;914110;Mecânico  de   manutenção do sistema hidráulico de aeronaves (oficina);Demais Ocupações;Demais Ocupações;Demais Ocupações
84490;914105;Outros mecânicos de manutenção de aeronaves;Demais Ocupações;Demais Ocupações;Demais Ocupações
84510;911305;Mecânico de manutenção de máquinas, em geral;Demais Ocupações;Demais Ocupações;Demais Ocupações
84515;914305;Mecânico de manutenção de máquinas a vapor de movimento alternativo;Demais Ocupações;Demais Ocupações;Demais Ocupações
84520;911120;Mecânico de manutenção de motores diesel (exceto de veículos automotores);Demais Ocupações;Demais Ocupações;Demais Ocupações
84525;911130;Mecânico de manutenção de turbinas (exceto de aeronaves e de embarcações);Demais Ocupações;Demais Ocupações;Demais Ocupações
84530;911325;Mecânico de manutenção de máquinas-ferramentas (usinagem de metais);Demais Ocupações;Demais Ocupações;Demais Ocupações
84535;913110;Mecânico de manutenção de equipamento de mineração;Demais Ocupações;Demais Ocupações;Demais Ocupações
84540;911310;Mecânico de manutenção de máquinas gráficas;Demais Ocupações;Demais Ocupações;Demais Ocupações
84545;911320;Mecânico de manutenção de máquinas têxteis;Demais Ocupações;Demais Ocupações;Demais Ocupações
84550;911315;Mecânico de manutenção de máquinas operatrizes (lavra de madeira);Demais Ocupações;Demais Ocupações;Demais Ocupações
84555;913115;Mecânico de manutenção de máquinas agrícolas;Demais Ocupações;Demais Ocupações;Demais Ocupações
84560;913120;Mecânico de manutenção de máquinas de construção e terraplenagem;Demais Ocupações;Demais Ocupações;Demais Ocupações
84565;954305;Mecânico de manutenção de máquinas de escritório;Demais Ocupações;Demais Ocupações;Demais Ocupações
84570;954120;Mecânico de manutenção de instalações mecânicas de edifícios;Demais Ocupações;Demais Ocupações;Demais Ocupações
84575;913105;Mecânico de manutenção de aparelhos de levantamento;Demais Ocupações;Demais Ocupações;Demais Ocupações
84580;911205;Mecânico  de manutenção de aparelhos de calefação, ventilação e refrigeração;Demais Ocupações;Demais Ocupações;Demais Ocupações
84585;914305;Mecânico de manutenção de veículos ferroviários;Demais Ocupações;Demais Ocupações;Demais Ocupações
84590;374305;Outros mecânicos de manutenção de máquinas;Demais Ocupações;Demais Ocupações;Demais Ocupações
84917;725105;Montador de máquinas, motores e acessórios (montagem em série);Demais Ocupações;Demais Ocupações;Demais Ocupações
84937;313205;Mecânico de manutenção (equipamento de central telefônica);Demais Ocupações;Demais Ocupações;Técnicos
84975;919310;Mecânico  de  manutenção  de bicicletas e veículos similares;Demais Ocupações;Demais Ocupações;Demais Ocupações
84977;919110;Lubrificador  de veículos  automotores (exceto embarcações);Demais Ocupações;Demais Ocupações;Demais Ocupações
84983;523115;Montador de fechaduras;Demais Ocupações;Demais Ocupações;Demais Ocupações
84987;919105;Lubrificador industrial;Demais Ocupações;Demais Ocupações;Demais Ocupações
84990;722105;Outros ajustadores mecânicos, montadores e mecânicos de máquinas, veículos e instrumentos de precisão;Demais Ocupações;Demais Ocupações;Demais Ocupações
85110;731135;Montador de equipamentos elétricos, em geral;Demais Ocupações;Demais Ocupações;Demais Ocupações
85120;731130;Montador de equipamentos elétricos (motores e dínamos);Demais Ocupações;Demais Ocupações;Demais Ocupações
85130;731160;Montador  de  equipamentos  elétricos (transformadores);Demais Ocupações;Demais Ocupações;Demais Ocupações
85140;731125;Montador de equipamentos elétricos (centrais  elétricas);Demais Ocupações;Demais Ocupações;Demais Ocupações
85150;731115;Montador de equipamentos elétricos (instrumentos de medição);Demais Ocupações;Demais Ocupações;Demais Ocupações
85160;731155;Montador de equipamentos elétricos (elevadores e equipamentos similares);Demais Ocupações;Demais Ocupações;Demais Ocupações
85170;731120;Montador de equipamentos elétricos (aparelhos elétrodomésticos);Demais Ocupações;Demais Ocupações;Demais Ocupações
85190;731135;Outros montadores de equipamentos elétricos;Demais Ocupações;Demais Ocupações;Demais Ocupações
85210;731150;Montador de equipamentos eletrônicos, em geral;Demais Ocupações;Demais Ocupações;Demais Ocupações
85220;731205;Montador de equipamentos eletrônicos  (estação  de rádio, televisão e equipamentos de radar);Demais Ocupações;Demais Ocupações;Demais Ocupações
85230;731105;Montador  de  equipamentos  eletrônicos (aparelhos médicos);Demais Ocupações;Demais Ocupações;Demais Ocupações
85240;731110;Montador de equipamentos eletrônicos (computadores e equipamentos auxiliares);Demais Ocupações;Demais Ocupações;Demais Ocupações
85250;731145;Montador   de  equipamentos  eletrônicos (máquinas industriais);Demais Ocupações;Demais Ocupações;Demais Ocupações
85260;731140;Montador  de equipamentos eletrônicos (instalações de sinalização);Demais Ocupações;Demais Ocupações;Demais Ocupações
85290;318305;Outros montadores de equipamentos eletrônicos;Demais Ocupações;Demais Ocupações;Técnicos
85405;951105;Eletricista de manutenção, em geral;Demais Ocupações;Demais Ocupações;Demais Ocupações
85410;951105;Reparador de aparelhos eletrônicos, em geral;Demais Ocupações;Demais Ocupações;Demais Ocupações
85415;951105;Eletricista  de manutenção de máquinas;Demais Ocupações;Demais Ocupações;Demais Ocupações
85430;954205;Reparador de aparelhos eletrodomésticos;Demais Ocupações;Demais Ocupações;Demais Ocupações
85440;954125;Operador eletromecânico;Demais Ocupações;Demais Ocupações;Demais Ocupações
85490;313215;Outros  reparadores  de equipamentos  elétricos  e eletrônicos;Demais Ocupações;Demais Ocupações;Técnicos
85510;715615;Eletricista de instalações, em geral;Demais Ocupações;Demais Ocupações;Demais Ocupações
85520;715610;Eletricista de instalações (edifícios);Demais Ocupações;Demais Ocupações;Demais Ocupações
85530;953105;Eletricista de instalações (aeronaves);Demais Ocupações;Demais Ocupações;Demais Ocupações
85535;953110;Eletricista de instalações (embarcações);Demais Ocupações;Demais Ocupações;Demais Ocupações
85540;953115;Eletricista  de instalações (veículos automotores, e máquinas operatrizes, exceto aeronaves e embarc;Demais Ocupações;Demais Ocupações;Demais Ocupações
85550;715605;Eletricista de instalações (cenários);Demais Ocupações;Demais Ocupações;Demais Ocupações
85590;715610;Outros eletricistas de instalações;Demais Ocupações;Demais Ocupações;Demais Ocupações
85640;731305;Instalador-reparador de estações telefônicas;Demais Ocupações;Demais Ocupações;Demais Ocupações
85645;313205;Instalador-reparador de centrais privadas de comutação telefônica;Demais Ocupações;Demais Ocupações;Técnicos
85650;731320;Instalador-reparador de linhas e aparelhos telefônicos;Demais Ocupações;Demais Ocupações;Demais Ocupações
85655;731305;Consertador  de centrais privadas de comutação telefônica;Demais Ocupações;Demais Ocupações;Demais Ocupações
85660;731320;Instalador de aparelhos telegráficos e teleimpressores;Demais Ocupações;Demais Ocupações;Demais Ocupações
85670;731305;Reparador de aparelhos telefônicos;Demais Ocupações;Demais Ocupações;Demais Ocupações
85680;731320;Reparador  de aparelhos telegráficos e teleimpressores;Demais Ocupações;Demais Ocupações;Demais Ocupações
85685;731315;Reparador de estações telefônicas;Demais Ocupações;Demais Ocupações;Demais Ocupações
85690;731150;Outros  instaladores e reparadores de equipamentos e aparelhos de telecomunicação;Demais Ocupações;Demais Ocupações;Demais Ocupações
85720;732120;Instalador  de  linhas  elétricas  de alta e baixa tensão (rede aérea);Demais Ocupações;Demais Ocupações;Demais Ocupações
85730;732125;Instalador eletricista (tração de veículos);Demais Ocupações;Demais Ocupações;Demais Ocupações
85740;732130;Instalador-reparador de redes telegráficas e telefônicas;Demais Ocupações;Demais Ocupações;Demais Ocupações
85750;732110;Emendador de cabos elétricos e telefônicos (aéreos e subterrâneos);Demais Ocupações;Demais Ocupações;Demais Ocupações
85760;732105;Eletricista  de  manutenção  de linhas elétricas e telefônicas;Demais Ocupações;Demais Ocupações;Demais Ocupações
85770;732115;Examinador  de cabos, linhas e aparelhos telefônicos;Demais Ocupações;Demais Ocupações;Demais Ocupações
85780;732135;Ligador de linhas telefônicas;Demais Ocupações;Demais Ocupações;Demais Ocupações
85790;313310;Outros  instaladores  e reparadores de linhas elétricas e de telecomunicações;Demais Ocupações;Demais Ocupações;Técnicos
85930;731175;Operador  de  linha de montagem (aparelhos elétricos);Demais Ocupações;Demais Ocupações;Demais Ocupações
85940;731180;Operador de linha de montagem (aparelhos eletrô- nicos);Demais Ocupações;Demais Ocupações;Demais Ocupações
85950;731165;Bobinador eletricista, à mão;Demais Ocupações;Demais Ocupações;Demais Ocupações
85960;731170;Bobinador eletricista, à máquina;Demais Ocupações;Demais Ocupações;Demais Ocupações
85990;313210;Outros  eletricistas,  eletrônicos e trabalhadores assemelhados não-classificados sob outras  epígra;Demais Ocupações;Demais Ocupações;Técnicos
86123;373110;Operador de estação de rádio;Demais Ocupações;Demais Ocupações;Demais Ocupações
86125;373220;Operador de estação de televisão;Demais Ocupações;Demais Ocupações;Demais Ocupações
86135;373115;Operador de equipamento de estúdio de rádio;Demais Ocupações;Demais Ocupações;Demais Ocupações
86140;373205;Operador de equipamento de estúdio de televisão;Demais Ocupações;Demais Ocupações;Demais Ocupações
86145;373205;Operador de vídeo;Demais Ocupações;Demais Ocupações;Demais Ocupações
86190;373110;Outros operadores de estações de rádio e televisão;Demais Ocupações;Demais Ocupações;Demais Ocupações
86220;374105;Operador de equipamento de gravação de som;Demais Ocupações;Demais Ocupações;Demais Ocupações
86230;374120;Operador de equipamento de amplificação de som;Demais Ocupações;Demais Ocupações;Demais Ocupações
86235;374420;Montador de filmes;Demais Ocupações;Demais Ocupações;Demais Ocupações
86240;374305;Operador de projetor cinematográfico;Demais Ocupações;Demais Ocupações;Demais Ocupações
86250;374125;Sonoplasta;Demais Ocupações;Demais Ocupações;Demais Ocupações
86260;374210;Maquinista de cenário;Demais Ocupações;Demais Ocupações;Demais Ocupações
