CBO Ocupação 2002;titulo;POTECoriginal;potec;Potec Grupo
231205;Professor da  educação de jovens e adultos do ensino fundamental (primeira a quarta série);Demais Ocupações;Demais Ocupações;Demais Ocupações
231310;Professor de educação artística do ensino fundamental;Demais Ocupações;Demais Ocupações;Demais Ocupações
231335;Professor de língua portuguesa do ensino fundamental;Demais Ocupações;Demais Ocupações;Demais Ocupações
231330;Professor de língua estrangeira moderna do ensino fundamental;Demais Ocupações;Demais Ocupações;Demais Ocupações
231325;Professor de história do ensino fundamental;Demais Ocupações;Demais Ocupações;Demais Ocupações
231305;Professor de ciências exatas e naturais do ensino fundamental;Demais Ocupações;Demais Ocupações;Demais Ocupações
231315;Professor de educação física do ensino fundamental;Demais Ocupações;Demais Ocupações;Demais Ocupações
231320;Professor de geografia do ensino fundamental;Demais Ocupações;Demais Ocupações;Demais Ocupações
231340;Professor de matemática do ensino fundamental;Demais Ocupações;Demais Ocupações;Demais Ocupações
232120;Professor de educação física no ensino médio;Demais Ocupações;Demais Ocupações;Demais Ocupações
232105;Professor de artes no ensino médio;Demais Ocupações;Demais Ocupações;Demais Ocupações
232165;Professor de química no ensino médio;Demais Ocupações;Demais Ocupações;Demais Ocupações
232160;Professor de psicologia no ensino médio;Demais Ocupações;Demais Ocupações;Demais Ocupações
232150;Professor de língua estrangeira moderna no ensino médio;Demais Ocupações;Demais Ocupações;Demais Ocupações
232140;Professor de história no ensino médio;Demais Ocupações;Demais Ocupações;Demais Ocupações
232115;Professor de disciplinas pedagógicas no ensino médio;Demais Ocupações;Demais Ocupações;Demais Ocupações
232130;Professor de física no ensino médio;Demais Ocupações;Demais Ocupações;Demais Ocupações
232135;Professor de geografia no ensino médio;Demais Ocupações;Demais Ocupações;Demais Ocupações
232145;Professor de língua e literatura brasileira no ensino médio;Demais Ocupações;Demais Ocupações;Demais Ocupações
232155;Professor de matemática no ensino médio;Demais Ocupações;Demais Ocupações;Demais Ocupações
232125;Professor de filosofia no ensino médio;Demais Ocupações;Demais Ocupações;Demais Ocupações
232110;Professor de biologia no ensino médio;Demais Ocupações;Demais Ocupações;Demais Ocupações
232170;Professor de sociologia no ensino médio;Demais Ocupações;Demais Ocupações;Demais Ocupações
233105;Professor da área de meio ambiente;Professores de ensino Profissional;Demais Ocupações;Demais Ocupações
233135;Professor de tecnologia e cálculo técnico;Professores de ensino Profissional;Demais Ocupações;Demais Ocupações
233115;Professor de técnicas agrícolas;Professores de ensino Profissional;Demais Ocupações;Demais Ocupações
233120;Professor de técnicas comerciais e secretariais;Professores de ensino Profissional;Demais Ocupações;Demais Ocupações
233110;Professor de desenho técnico;Professores de ensino Profissional;Demais Ocupações;Demais Ocupações
233130;Professor de técnicas industriais;Professores de ensino Profissional;Demais Ocupações;Demais Ocupações
233125;Professor de técnicas de enfermagem;Professores de ensino Profissional;Demais Ocupações;Demais Ocupações
233225;Professor instrutor de ensino e aprendizagem em serviços;Professores de ensino Profissional;Demais Ocupações;Demais Ocupações
233220;Professor instrutor de ensino e aprendizagem agroflorestal;Professores de ensino Profissional;Demais Ocupações;Demais Ocupações
233215;Instrutor de aprendizagem e treinamento comercial;Professores de ensino Profissional;Demais Ocupações;Demais Ocupações
233205;Instrutor de aprendizagem e treinamento agropecuário;Professores de ensino Profissional;Demais Ocupações;Demais Ocupações
233210;Instrutor de aprendizagem e treinamento industrial;Professores de ensino Profissional;Demais Ocupações;Demais Ocupações
234105;Professor de matemática aplicada (no ensino superior);Professores de ensino superior;Demais Ocupações;Demais Ocupações
234110;Professor de matemática pura (no ensino superior);Professores de ensino superior;Demais Ocupações;Demais Ocupações
234115;Professor de estatística (no ensino superior);Professores de ensino superior;Demais Ocupações;Demais Ocupações
234120;Professor de computação (no ensino superior);Professores de ensino superior;Demais Ocupações;Demais Ocupações
234125;Professor de pesquisa operacional (no ensino superior);Professores de ensino superior;Demais Ocupações;Demais Ocupações
234205;Professor de física (ensino superior);Professores de ensino superior;Demais Ocupações;Demais Ocupações
234215;Professor de astronomia (ensino superior);Professores de ensino superior;Demais Ocupações;Demais Ocupações
234210;Professor de química (ensino superior);Professores de ensino superior;Demais Ocupações;Demais Ocupações
234305;Professor de arquitetura;Professores de ensino superior;Demais Ocupações;Demais Ocupações
234315;Professor de geofísica;Professores de ensino superior;Demais Ocupações;Demais Ocupações
234310;Professor de engenharia;Professores de ensino superior;Demais Ocupações;Demais Ocupações
234320;Professor de geologia;Professores de ensino superior;Demais Ocupações;Demais Ocupações
234410;Professor de educação física no ensino superior;Professores de ensino superior;Demais Ocupações;Demais Ocupações
234455;Professor de terapia ocupacional;Professores de ensino superior;Demais Ocupações;Demais Ocupações
234460;Professor de zootecnia do ensino superior;Professores de ensino superior;Demais Ocupações;Demais Ocupações
234420;Professor de farmácia e bioquímica;Professores de ensino superior;Demais Ocupações;Demais Ocupações
234425;Professor de fisioterapia;Professores de ensino superior;Demais Ocupações;Demais Ocupações
234430;Professor de fonoaudiologia;Professores de ensino superior;Demais Ocupações;Demais Ocupações
234435;Professor de medicina;Professores de ensino superior;Demais Ocupações;Demais Ocupações
234440;Professor de medicina veterinária;Professores de ensino superior;Demais Ocupações;Demais Ocupações
234445;Professor de nutrição;Professores de ensino superior;Demais Ocupações;Demais Ocupações
234450;Professor de odontologia;Professores de ensino superior;Demais Ocupações;Demais Ocupações
234405;Professor de ciências biológicas do ensino superior;Professores de ensino superior;Demais Ocupações;Demais Ocupações
234415;Professor de enfermagem do ensino superior;Professores de ensino superior;Demais Ocupações;Demais Ocupações
234505;Professor de ensino superior na área de didática;Professores de ensino superior;Demais Ocupações;Demais Ocupações
234510;Professor de ensino superior na área de orientação educacional;Professores de ensino superior;Demais Ocupações;Demais Ocupações
234515;Professor de ensino superior na área de pesquisa educacional;Professores de ensino superior;Demais Ocupações;Demais Ocupações
234520;Professor de ensino superior na área de prática de ensino;Professores de ensino superior;Demais Ocupações;Demais Ocupações
234664;Professor de outras línguas e literaturas;Professores de ensino superior;Demais Ocupações;Demais Ocupações
234656;Professor de literatura italiana;Professores de ensino superior;Demais Ocupações;Demais Ocupações
234652;Professor de literatura inglesa;Professores de ensino superior;Demais Ocupações;Demais Ocupações
234648;Professor de literatura francesa;Professores de ensino superior;Demais Ocupações;Demais Ocupações
234644;Professor de literatura espanhola;Professores de ensino superior;Demais Ocupações;Demais Ocupações
234684;Professor de teoria da literatura;Professores de ensino superior;Demais Ocupações;Demais Ocupações
234680;Professor de semiótica;Professores de ensino superior;Demais Ocupações;Demais Ocupações
234676;Professor de filologia e crítica textual;Professores de ensino superior;Demais Ocupações;Demais Ocupações
234672;Professor de lingüística e lingüística aplicada;Professores de ensino superior;Demais Ocupações;Demais Ocupações
234668;Professor de línguas estrangeiras modernas;Professores de ensino superior;Demais Ocupações;Demais Ocupações
234660;Professor de literatura de línguas estrangeiras modernas;Professores de ensino superior;Demais Ocupações;Demais Ocupações
234604;Professor de língua alemã;Professores de ensino superior;Demais Ocupações;Demais Ocupações
234608;Professor de língua italiana;Professores de ensino superior;Demais Ocupações;Demais Ocupações
234612;Professor de língua francesa;Professores de ensino superior;Demais Ocupações;Demais Ocupações
234616;Professor de língua inglesa;Professores de ensino superior;Demais Ocupações;Demais Ocupações
234620;Professor de língua espanhola;Professores de ensino superior;Demais Ocupações;Demais Ocupações
234624;Professor de língua portuguesa;Professores de ensino superior;Demais Ocupações;Demais Ocupações
234628;Professor de literatura brasileira;Professores de ensino superior;Demais Ocupações;Demais Ocupações
234636;Professor de literatura alemã;Professores de ensino superior;Demais Ocupações;Demais Ocupações
234640;Professor de literatura comparada;Professores de ensino superior;Demais Ocupações;Demais Ocupações
234632;Professor de literatura portuguesa;Professores de ensino superior;Demais Ocupações;Demais Ocupações
234770;Professor de sociologia do ensino superior;Professores de ensino superior;Demais Ocupações;Demais Ocupações
234765;Professor de serviço social do ensino superior;Professores de ensino superior;Demais Ocupações;Demais Ocupações
234760;Professor de psicologia do ensino superior;Professores de ensino superior;Demais Ocupações;Demais Ocupações
234755;Professor de museologia do ensino superior;Professores de ensino superior;Demais Ocupações;Demais Ocupações
234750;Professor de jornalismo;Professores de ensino superior;Demais Ocupações;Demais Ocupações
234745;Professor de história do ensino superior;Professores de ensino superior;Demais Ocupações;Demais Ocupações
234740;Professor de geografia do ensino superior;Professores de ensino superior;Demais Ocupações;Demais Ocupações
234735;Professor de filosofia do ensino superior;Professores de ensino superior;Demais Ocupações;Demais Ocupações
234730;Professor de direito do ensino superior;Professores de ensino superior;Demais Ocupações;Demais Ocupações
234725;Professor de comunicação social do ensino superior;Professores de ensino superior;Demais Ocupações;Demais Ocupações
234720;Professor de ciência política do ensino superior;Professores de ensino superior;Demais Ocupações;Demais Ocupações
234715;Professor de biblioteconomia do ensino superior;Professores de ensino superior;Demais Ocupações;Demais Ocupações
234705;Professor de antropologia do ensino superior;Professores de ensino superior;Demais Ocupações;Demais Ocupações
234710;Professor de arquivologia do ensino superior;Professores de ensino superior;Demais Ocupações;Demais Ocupações
234815;Professor de contabilidade;Professores de ensino superior;Demais Ocupações;Demais Ocupações
234810;Professor de administração;Professores de ensino superior;Demais Ocupações;Demais Ocupações
234805;Professor de economia;Professores de ensino superior;Demais Ocupações;Demais Ocupações
234910;Professor de artes visuais no ensino superior (artes plásticas e multimídia);Professores de ensino superior;Demais Ocupações;Demais Ocupações
234905;Professor de artes do espetáculo no ensino superior;Professores de ensino superior;Demais Ocupações;Demais Ocupações
234915;Professor de música no ensino superior;Professores de ensino superior;Demais Ocupações;Demais Ocupações
239205;Professor de alunos com deficiência auditiva e surdos;Demais Ocupações;Demais Ocupações;Demais Ocupações
239210;Professor de alunos com deficiência física;Demais Ocupações;Demais Ocupações;Demais Ocupações
239225;Professor de alunos com deficiência visual;Demais Ocupações;Demais Ocupações;Demais Ocupações
239220;Professor de alunos com deficiência múltipla;Demais Ocupações;Demais Ocupações;Demais Ocupações
239215;Professor de alunos com deficiência mental;Demais Ocupações;Demais Ocupações;Demais Ocupações
239405;Coordenador pedagógico;Demais Ocupações;Demais Ocupações;Demais Ocupações
239410;Orientador educacional;Demais Ocupações;Demais Ocupações;Demais Ocupações
239415;Pedagogo;Demais Ocupações;Demais Ocupações;Demais Ocupações
239420;Professor de técnicas e recursos audiovisuais;Demais Ocupações;Demais Ocupações;Demais Ocupações
239425;Psicopedagogo;Demais Ocupações;Demais Ocupações;Demais Ocupações
239430;Supervisor de ensino;Demais Ocupações;Demais Ocupações;Demais Ocupações
239435;Designer educacional;Demais Ocupações;Demais Ocupações;Demais Ocupações
241040;Consultor jurídico;Demais Ocupações;Demais Ocupações;Demais Ocupações
241035;Advogado (direito do trabalho);Demais Ocupações;Demais Ocupações;Demais Ocupações
241030;Advogado (áreas especiais);Demais Ocupações;Demais Ocupações;Demais Ocupações
241025;Advogado (direito penal);Demais Ocupações;Demais Ocupações;Demais Ocupações
241020;Advogado (direito público);Demais Ocupações;Demais Ocupações;Demais Ocupações
241015;Advogado (direito civil);Demais Ocupações;Demais Ocupações;Demais Ocupações
241010;Advogado de empresa;Demais Ocupações;Demais Ocupações;Demais Ocupações
241005;Advogado;Demais Ocupações;Demais Ocupações;Demais Ocupações
241205;Advogado da união;Demais Ocupações;Demais Ocupações;Demais Ocupações
241220;Procurador do estado;Demais Ocupações;Demais Ocupações;Demais Ocupações
241215;Procurador da fazenda nacional;Demais Ocupações;Demais Ocupações;Demais Ocupações
241230;Procurador federal;Demais Ocupações;Demais Ocupações;Demais Ocupações
241235;Procurador fundacional;Demais Ocupações;Demais Ocupações;Demais Ocupações
241210;Procurador autárquico;Demais Ocupações;Demais Ocupações;Demais Ocupações
241225;Procurador do município;Demais Ocupações;Demais Ocupações;Demais Ocupações
241320;Oficial do registro de distribuições;Demais Ocupações;Demais Ocupações;Demais Ocupações
241330;Oficial do registro de títulos e documentos;Demais Ocupações;Demais Ocupações;Demais Ocupações
241315;Oficial do registro civil de pessoas naturais;Demais Ocupações;Demais Ocupações;Demais Ocupações
241310;Oficial do registro civil de pessoas jurídicas;Demais Ocupações;Demais Ocupações;Demais Ocupações
241305;Oficial de registro de contratos marítimos;Demais Ocupações;Demais Ocupações;Demais Ocupações
241335;Tabelião de notas;Demais Ocupações;Demais Ocupações;Demais Ocupações
241325;Oficial do registro de imóveis;Demais Ocupações;Demais Ocupações;Demais Ocupações
241340;Tabelião de protestos;Demais Ocupações;Demais Ocupações;Demais Ocupações
242235;Promotor de justiça;Demais Ocupações;Demais Ocupações;Demais Ocupações
242220;Procurador do trabalho;Demais Ocupações;Demais Ocupações;Demais Ocupações
242205;Procurador da república;Demais Ocupações;Demais Ocupações;Demais Ocupações
242250;Subprocurador-geral do trabalho;Demais Ocupações;Demais Ocupações;Demais Ocupações
242245;Subprocurador-geral da república;Demais Ocupações;Demais Ocupações;Demais Ocupações
242240;Subprocurador de justiça militar;Demais Ocupações;Demais Ocupações;Demais Ocupações
242230;Procurador regional do trabalho;Demais Ocupações;Demais Ocupações;Demais Ocupações
242225;Procurador regional da república;Demais Ocupações;Demais Ocupações;Demais Ocupações
242210;Procurador de justiça;Demais Ocupações;Demais Ocupações;Demais Ocupações
242215;Procurador de justiça militar;Demais Ocupações;Demais Ocupações;Demais Ocupações
242305;Delegado de polícia;Demais Ocupações;Demais Ocupações;Demais Ocupações
242405;Defensor público;Demais Ocupações;Demais Ocupações;Demais Ocupações
242410;Procurador da assistência judiciária;Demais Ocupações;Demais Ocupações;Demais Ocupações
242910;Oficial técnico de inteligência;Demais Ocupações;Demais Ocupações;Demais Ocupações
242905;Oficial de inteligência;Demais Ocupações;Demais Ocupações;Demais Ocupações
251105;Antropólogo;Demais Ocupações;Demais Ocupações;Demais Ocupações
251110;Arqueólogo;Demais Ocupações;Demais Ocupações;Demais Ocupações
251115;Cientista político;Demais Ocupações;Demais Ocupações;Demais Ocupações
251120;Sociólogo;Demais Ocupações;Demais Ocupações;Demais Ocupações
251205;Economista;Demais Ocupações;Demais Ocupações;Demais Ocupações
251215;Economista financeiro;Demais Ocupações;Demais Ocupações;Demais Ocupações
251210;Economista agroindustrial;Demais Ocupações;Demais Ocupações;Demais Ocupações
251220;Economista industrial;Demais Ocupações;Demais Ocupações;Demais Ocupações
251225;Economista do setor público;Demais Ocupações;Demais Ocupações;Demais Ocupações
251230;Economista ambiental;Demais Ocupações;Demais Ocupações;Demais Ocupações
251235;Economista regional e urbano;Demais Ocupações;Demais Ocupações;Demais Ocupações
251305;Geógrafo;Demais Ocupações;Demais Ocupações;Demais Ocupações
251405;Filósofo;Demais Ocupações;Demais Ocupações;Demais Ocupações
251550;Psicanalista;Demais Ocupações;Demais Ocupações;Demais Ocupações
251545;Neuropsicólogo;Demais Ocupações;Demais Ocupações;Demais Ocupações
251540;Psicólogo do trabalho;Demais Ocupações;Demais Ocupações;Demais Ocupações
251535;Psicólogo do trânsito;Demais Ocupações;Demais Ocupações;Demais Ocupações
251530;Psicólogo social;Demais Ocupações;Demais Ocupações;Demais Ocupações
251505;Psicólogo educacional;Demais Ocupações;Demais Ocupações;Demais Ocupações
251515;Psicólogo do esporte;Demais Ocupações;Demais Ocupações;Demais Ocupações
251510;Psicólogo clínico;Demais Ocupações;Demais Ocupações;Demais Ocupações
251520;Psicólogo hospitalar;Demais Ocupações;Demais Ocupações;Demais Ocupações
251525;Psicólogo jurídico;Demais Ocupações;Demais Ocupações;Demais Ocupações
251555;Psicólogo acupunturista;Demais Ocupações;Demais Ocupações;Demais Ocupações
251605;Assistente social;Demais Ocupações;Demais Ocupações;Demais Ocupações
251610;Economista doméstico;Demais Ocupações;Demais Ocupações;Demais Ocupações
252105;Administrador;Demais Ocupações;Demais Ocupações;Demais Ocupações
252205;Auditor (contadores e afins);Demais Ocupações;Demais Ocupações;Demais Ocupações
252210;Contador;Demais Ocupações;Demais Ocupações;Demais Ocupações
252215;Perito contábil;Demais Ocupações;Demais Ocupações;Demais Ocupações
252320;Tecnólogo em secretariado escolar;Demais Ocupações;Demais Ocupações;Demais Ocupações
252315;Secretária trilíngüe;Demais Ocupações;Demais Ocupações;Demais Ocupações
252305;Secretária(o) executiva(o);Demais Ocupações;Demais Ocupações;Demais Ocupações
252310;Secretário  bilíngüe;Demais Ocupações;Demais Ocupações;Demais Ocupações
252405;Analista de recursos humanos;Demais Ocupações;Demais Ocupações;Demais Ocupações
252545;Analista financeiro (instituições financeiras);Demais Ocupações;Demais Ocupações;Demais Ocupações
252540;Analista de produtos bancários;Demais Ocupações;Demais Ocupações;Demais Ocupações
252535;Analista de leasing;Demais Ocupações;Demais Ocupações;Demais Ocupações
252550;Profissional de relações com investidores;Demais Ocupações;Demais Ocupações;Demais Ocupações
252530;Analista de crédito rural;Demais Ocupações;Demais Ocupações;Demais Ocupações
252505;Administrador de fundos e carteiras de investimento;Demais Ocupações;Demais Ocupações;Demais Ocupações
252525;Analista de crédito (instituições financeiras);Demais Ocupações;Demais Ocupações;Demais Ocupações
252515;Analista de cobrança (instituições financeiras);Demais Ocupações;Demais Ocupações;Demais Ocupações
252510;Analista de câmbio;Demais Ocupações;Demais Ocupações;Demais Ocupações
252605;Gestor em segurança;Demais Ocupações;Demais Ocupações;Demais Ocupações
252725;Analista de gestão de estoque;Demais Ocupações;Demais Ocupações;Demais Ocupações
252720;Analista de projetos logisticos;Demais Ocupações;Demais Ocupações;Demais Ocupações
252715;Analista de logistica;Demais Ocupações;Demais Ocupações;Demais Ocupações
252705;Analista de pcp (programação e controle da produção);Demais Ocupações;Demais Ocupações;Demais Ocupações
252710;Analista de planejamento de materias;Demais Ocupações;Demais Ocupações;Demais Ocupações
253135;Diretor de contas (publicidade);Demais Ocupações;Demais Ocupações;Demais Ocupações
253130;Diretor de criação;Demais Ocupações;Demais Ocupações;Demais Ocupações
253125;Diretor de arte (publicidade);Demais Ocupações;Demais Ocupações;Demais Ocupações
253120;Diretor de mídia (publicidade);Demais Ocupações;Demais Ocupações;Demais Ocupações
253115;Publicitário;Demais Ocupações;Demais Ocupações;Demais Ocupações
253140;Agenciador de propaganda;Demais Ocupações;Demais Ocupações;Demais Ocupações
253110;Redator de publicidade;Demais Ocupações;Demais Ocupações;Demais Ocupações
253205;Gerente de captação (fundos e investimentos institucionais);Demais Ocupações;Demais Ocupações;Demais Ocupações
253210;Gerente de clientes especiais (private);Demais Ocupações;Demais Ocupações;Demais Ocupações
253215;Gerente de contas - pessoa física e jurídica;Demais Ocupações;Demais Ocupações;Demais Ocupações
253220;Gerente de grandes contas (corporate);Demais Ocupações;Demais Ocupações;Demais Ocupações
253225;Operador de negócios;Demais Ocupações;Demais Ocupações;Demais Ocupações
253305;Corretor de valores, ativos financeiros, mercadorias e derivativos;Demais Ocupações;Demais Ocupações;Demais Ocupações
254105;Auditor-fiscal da receita federal;Demais Ocupações;Demais Ocupações;Demais Ocupações
254110;Técnico da receita federal;Demais Ocupações;Demais Ocupações;Demais Ocupações
254205;Auditor-fiscal da previdência social;Demais Ocupações;Demais Ocupações;Demais Ocupações
254305;Auditor-fiscal do trabalho;Demais Ocupações;Demais Ocupações;Demais Ocupações
254310;Agente de higiene e segurança;Demais Ocupações;Demais Ocupações;Demais Ocupações
254405;Fiscal de tributos estadual;Demais Ocupações;Demais Ocupações;Demais Ocupações
254410;Fiscal de tributos municipal;Demais Ocupações;Demais Ocupações;Demais Ocupações
254415;Técnico de tributos estadual;Demais Ocupações;Demais Ocupações;Demais Ocupações
254420;Técnico de tributos municipal;Demais Ocupações;Demais Ocupações;Demais Ocupações
254505;Fiscal de atividades urbanas;Demais Ocupações;Demais Ocupações;Demais Ocupações
261140;Revisor de texto;Demais Ocupações;Demais Ocupações;Demais Ocupações
261110;Assessor de imprensa;Demais Ocupações;Demais Ocupações;Demais Ocupações
261115;Diretor de redação;Demais Ocupações;Demais Ocupações;Demais Ocupações
261120;Editor;Demais Ocupações;Demais Ocupações;Demais Ocupações
261125;Jornalista;Demais Ocupações;Demais Ocupações;Demais Ocupações
261130;Produtor de texto;Demais Ocupações;Demais Ocupações;Demais Ocupações
261105;Arquivista pesquisador (jornalismo);Demais Ocupações;Demais Ocupações;Demais Ocupações
261135;Repórter (exclusive rádio e televisão);Demais Ocupações;Demais Ocupações;Demais Ocupações
261210;Documentalista;Demais Ocupações;Demais Ocupações;Demais Ocupações
261215;Analista de informações (pesquisador de informações de rede);Demais Ocupações;Demais Ocupações;Demais Ocupações
261205;Bibliotecário;Demais Ocupações;Demais Ocupações;Demais Ocupações
261305;Arquivista;Demais Ocupações;Demais Ocupações;Demais Ocupações
261310;Museólogo;Demais Ocupações;Demais Ocupações;Demais Ocupações
261405;Filólogo;Demais Ocupações;Demais Ocupações;Demais Ocupações
261430;Audiodescritor;Demais Ocupações;Demais Ocupações;Demais Ocupações
261410;Intérprete;Demais Ocupações;Demais Ocupações;Demais Ocupações
261415;Lingüista;Demais Ocupações;Demais Ocupações;Demais Ocupações
261420;Tradutor;Demais Ocupações;Demais Ocupações;Demais Ocupações
261425;Intérprete de língua de sinais;Demais Ocupações;Demais Ocupações;Demais Ocupações
261530;Redator de textos técnicos;Demais Ocupações;Demais Ocupações;Demais Ocupações
261525;Poeta;Demais Ocupações;Demais Ocupações;Demais Ocupações
261520;Escritor de não ficção;Demais Ocupações;Demais Ocupações;Demais Ocupações
261515;Escritor de ficção;Demais Ocupações;Demais Ocupações;Demais Ocupações
261510;Crítico;Demais Ocupações;Demais Ocupações;Demais Ocupações
261505;Autor-roteirista;Demais Ocupações;Demais Ocupações;Demais Ocupações
261620;Editor de revista;Demais Ocupações;Demais Ocupações;Demais Ocupações
261625;Editor de revista científica;Demais Ocupações;Demais Ocupações;Demais Ocupações
261615;Editor de mídia eletrônica;Demais Ocupações;Demais Ocupações;Demais Ocupações
261610;Editor de livro;Demais Ocupações;Demais Ocupações;Demais Ocupações
